{
  "ir_id": "speck32-64-r9-diff.structural-ir.v0",
  "status": "reviewable",
  "source_algorithm_description_id": "eprint-2016-407.speck32-64.r9-diff.algorithm-description.v0",
  "analysis_context": {
    "primitive_id": "speck32_64",
    "attack_family": "differential",
    "semantic_domain": "xor_differential",
    "granularity": "word",
    "exactness_goal": "exact_under_paper_model",
    "target_round_start": 0,
    "target_round_end": 8,
    "objective_metric": "negative log2 differential probability of a single differential characteristic",
    "objective_direction": "minimize",
    "scenario_flags": {
      "related_key": false,
      "distinguisher_only": true,
      "key_recovery_stage_present": false
    },
    "validation_anchor_ref": "eprint-2016-407 Table 2 Speck32 differential-characteristic summary row",
    "notes": "This IR is task-scoped to the 9-round paper checkpoint rather than to the full 22-round Speck-32/64 primitive."
  },
  "index_domains": [
    {
      "domain_id": "rounds_r0_r8",
      "kind": "round",
      "start": 0,
      "end": 8,
      "purpose": "The 9 encryption rounds inside the current analysis scope."
    },
    {
      "domain_id": "round_boundaries_r0_r9",
      "kind": "round_boundary",
      "start": 0,
      "end": 9,
      "purpose": "State boundaries before round 0 and after each modeled round."
    },
    {
      "domain_id": "key_updates_u0_u7",
      "kind": "update",
      "start": 0,
      "end": 7,
      "purpose": "Key-schedule updates needed to derive round keys K1 through K8 from the initial K0."
    },
    {
      "domain_id": "schedule_slots_s0_s2",
      "kind": "slot",
      "start": 0,
      "end": 2,
      "purpose": "The three auxiliary Speck key-schedule slots that form the rolling queue."
    },
    {
      "domain_id": "word_bits_b0_b15",
      "kind": "bit",
      "start": 0,
      "end": 15,
      "purpose": "Bit positions of a 16-bit Speck word."
    }
  ],
  "state_families": [
    {
      "family_id": "left_word_pre_round",
      "role": "left_branch_input_boundary",
      "container_kind": "word",
      "width_bits": 16,
      "index_domain_refs": [
        "round_boundaries_r0_r9"
      ],
      "summary": "The left 16-bit encryption branch at the input boundary of each modeled round."
    },
    {
      "family_id": "right_word_pre_round",
      "role": "right_branch_input_boundary",
      "container_kind": "word",
      "width_bits": 16,
      "index_domain_refs": [
        "round_boundaries_r0_r9"
      ],
      "summary": "The right 16-bit encryption branch at the input boundary of each modeled round."
    },
    {
      "family_id": "left_word_after_rotate",
      "role": "left_branch_after_rotation",
      "container_kind": "word",
      "width_bits": 16,
      "index_domain_refs": [
        "rounds_r0_r8"
      ],
      "summary": "The left branch after the round-local right rotation by 7."
    },
    {
      "family_id": "left_word_after_add",
      "role": "left_branch_after_modular_add",
      "container_kind": "word",
      "width_bits": 16,
      "index_domain_refs": [
        "rounds_r0_r8"
      ],
      "summary": "The intermediate left branch after modular addition and before xor with the round key."
    },
    {
      "family_id": "round_key",
      "role": "encryption_round_key",
      "container_kind": "word",
      "width_bits": 16,
      "index_domain_refs": [
        "rounds_r0_r8"
      ],
      "summary": "The 16-bit round key consumed by each modeled encryption round."
    },
    {
      "family_id": "right_word_after_rotate",
      "role": "right_branch_after_rotation",
      "container_kind": "word",
      "width_bits": 16,
      "index_domain_refs": [
        "rounds_r0_r8"
      ],
      "summary": "The right branch after the round-local left rotation by 2."
    },
    {
      "family_id": "schedule_l_words_pre_update",
      "role": "rolling_schedule_queue",
      "container_kind": "word_array",
      "width_bits": 16,
      "index_domain_refs": [
        "key_updates_u0_u7",
        "schedule_slots_s0_s2"
      ],
      "summary": "The three auxiliary Speck schedule words before each modeled key update."
    },
    {
      "family_id": "selected_schedule_word_after_rotate",
      "role": "selected_schedule_word_after_rotation",
      "container_kind": "word",
      "width_bits": 16,
      "index_domain_refs": [
        "key_updates_u0_u7"
      ],
      "summary": "The currently selected auxiliary schedule word after the right rotation by 7."
    },
    {
      "family_id": "selected_schedule_word_after_add",
      "role": "selected_schedule_word_after_modular_add",
      "container_kind": "word",
      "width_bits": 16,
      "index_domain_refs": [
        "key_updates_u0_u7"
      ],
      "summary": "The selected schedule word after modular addition with the current round key."
    },
    {
      "family_id": "selected_schedule_word_after_index_xor",
      "role": "selected_schedule_word_after_constant_injection",
      "container_kind": "word",
      "width_bits": 16,
      "index_domain_refs": [
        "key_updates_u0_u7"
      ],
      "summary": "The selected schedule word after xor with the round index constant."
    },
    {
      "family_id": "round_key_after_rotate",
      "role": "round_key_after_rotation",
      "container_kind": "word",
      "width_bits": 16,
      "index_domain_refs": [
        "key_updates_u0_u7"
      ],
      "summary": "The current round key after the key-schedule left rotation by 2."
    },
    {
      "family_id": "round_index_constant",
      "role": "key_schedule_round_constant",
      "container_kind": "bitvector",
      "width_bits": 5,
      "index_domain_refs": [
        "key_updates_u0_u7"
      ],
      "summary": "The round index constant injected during each modeled Speck key update."
    }
  ],
  "operator_templates": [
    {
      "template_id": "enc_rotate_left_word_right",
      "name": "Encryption rotate left branch right",
      "op_type": "rotate_right",
      "repeat_domain_refs": [
        "rounds_r0_r8"
      ],
      "input_family_refs": [
        "left_word_pre_round"
      ],
      "output_family_refs": [
        "left_word_after_rotate"
      ],
      "operator_parameters": {
        "rotation_amount": 7,
        "word_size_bits": 16
      },
      "semantic_tags": [
        "arx",
        "encryption_round_step"
      ],
      "summary": "Rotate the left encryption branch right by 7 in each modeled round.",
      "evidence": [
        "ePrint 2013/404 Section 4",
        "ePrint 2016/407 Table 3"
      ]
    },
    {
      "template_id": "enc_add_branches",
      "name": "Encryption modular add branches",
      "op_type": "add_mod",
      "repeat_domain_refs": [
        "rounds_r0_r8"
      ],
      "input_family_refs": [
        "left_word_after_rotate",
        "right_word_pre_round"
      ],
      "output_family_refs": [
        "left_word_after_add"
      ],
      "operator_parameters": {
        "modulus": "2^16",
        "word_size_bits": 16
      },
      "semantic_tags": [
        "arx",
        "nonlinear_weight_source"
      ],
      "refinement_requirements": [
        {
          "slot_id": "enc_add_mod_weight",
          "kind": "local_rule_pack",
          "domain": "xor_differential",
          "rule_family": "arx_add_mod_xor_differential",
          "required_for": "exact differential-weight propagation through the Speck round addition",
          "summary": "Later semantic refinement must attach xor-differential modular-add semantics to the encryption add_mod template."
        }
      ],
      "summary": "Add the rotated left branch and the right branch modulo 2^16 in each modeled round.",
      "evidence": [
        "ePrint 2013/404 Section 4"
      ]
    },
    {
      "template_id": "enc_xor_round_key",
      "name": "Encryption xor round key",
      "op_type": "xor",
      "repeat_domain_refs": [
        "rounds_r0_r8"
      ],
      "input_family_refs": [
        "left_word_after_add",
        "round_key"
      ],
      "output_family_refs": [
        "left_word_pre_round"
      ],
      "operator_parameters": {
        "word_size_bits": 16
      },
      "semantic_tags": [
        "arx",
        "encryption_round_step"
      ],
      "summary": "Xor the current round key into the modular-add result to obtain the updated left branch carried to the next round boundary.",
      "evidence": [
        "ePrint 2013/404 Figure 4.1"
      ]
    },
    {
      "template_id": "enc_rotate_right_word_left",
      "name": "Encryption rotate right branch left",
      "op_type": "rotate_left",
      "repeat_domain_refs": [
        "rounds_r0_r8"
      ],
      "input_family_refs": [
        "right_word_pre_round"
      ],
      "output_family_refs": [
        "right_word_after_rotate"
      ],
      "operator_parameters": {
        "rotation_amount": 2,
        "word_size_bits": 16
      },
      "semantic_tags": [
        "arx",
        "encryption_round_step"
      ],
      "summary": "Rotate the right encryption branch left by 2 in each modeled round.",
      "evidence": [
        "ePrint 2013/404 Section 4",
        "ePrint 2016/407 Table 3"
      ]
    },
    {
      "template_id": "enc_xor_branches",
      "name": "Encryption xor branches",
      "op_type": "xor",
      "repeat_domain_refs": [
        "rounds_r0_r8"
      ],
      "input_family_refs": [
        "right_word_after_rotate",
        "left_word_pre_round"
      ],
      "output_family_refs": [
        "right_word_pre_round"
      ],
      "operator_parameters": {
        "word_size_bits": 16
      },
      "semantic_tags": [
        "arx",
        "round_boundary_transition"
      ],
      "summary": "Xor the rotated right branch with the updated left branch to obtain the next right-boundary value.",
      "evidence": [
        "ePrint 2013/404 Figure 4.1"
      ]
    },
    {
      "template_id": "ks_rotate_schedule_word",